Question,Answer,Topic,Keywords
"I am on metformin 1000mg bid for pcos & was prescribed Percocet 10/650 for a severely displaced fracture needing surgery. I drink a glass of red wine nightly for heart heglth Bhc cardiac disease runs in my family... Should I be concerned a our elastase liver function test? I am also on Zoloft 150 daily, adderall 30mg bid & clonazepam as needed who I take a few night a a week","Hi, dairy have gone through your question. I can understand your concern. You taken percent, clonazepam, Zoloft, Adderall so in my opinion you should avoid alcohol. It will damage the liver and will put you in trouble. You should check your liver enzymes levels once and also go for ultrasound abdomen once to rule out any alcoholic liver disease. Hope I have answered your question. If you have any doubts then feel free to ask me. I will be happy to answer. Wish you a very good health.",PCOS,"pcos, metformin"
pcod irregular periods 37x31mm cyst in LT ovary on11july its my first day. 7x7mm inRTovary and 11x12mm inLT ovary on22 july 12day. 11x12mm inRTovary and 8x9mm inLT ovary on27july 17day. 1 what does this mean? 2 IS ovulation happen this time? 3 slow and late growth of follicle as in my case .ISany chance of getting preganant? 4 what to do now? 5 plssssssssssss answer soon,"Hi hi Joshi., the above report stating the measurement of the largest cyst is 37by31 in left ovary... .the other follicles are of different sizes respect to the duration. Even though many follicles develop, only one may ovulate or many at a time hence fertilization will be disturbed... you can have coitus with your husband.... and then after a week you need to follow up by USG. Hope I have answered your question. Take care.",PCOS,"pcod, irregular periods"
"I m a type 2 diabetic. My doctor changed my meds to three pills 5 months ago, Metformin gave extreme gastro side effects. So I have been taking Januvia, Glimeperide and Glipezide. It kept my blood sugar much lower but not perfect. I had 3 episodes of symptoms of low blood sugar but I never got a reading lower than 80. Now my pharmacists has questioned the 3 medication so, as of 3 weeks ago I no longer take Glimeperide. Now I m having mild pressure in my abdomen and sternem, shallow breathing and muscle tension for no reason. Any thoughts?","Hi sir. Usually diabetic medicines with metformin may cause abdominal problems like gastritis, ulcer.make sure that your sugar level is under control especially HE a1c is under control. Pain in lower abdomen and sternum is exactly due to gastritis so it's better to take anti ulcer medicines to solve this problem avoid taking oily and spicy foods avoid taking tea coffee or milk avoid some vegetables like radish cabbage and cauliflower so that it may help to reduce gastritis. Consult a physician for medications, thank you.",PCOS,metformin
"i am taking glycomate sr igram at night before meal. my fasting sugar was 150-160 range before medication and PP was 170-180. i have strict diet control. after taking medicine for one & 1/2 months now i am feeling sleepy which i do not had earlier. presently my Fastinf sugar is 129-141 anf PP is 140-150. si do Yoga for i/2 hrs, walking for 20 minutes and Gym foe 15 minutes daily. Should i stop medicine.D .mitra age 55 ,male,kolkata india","Hi Mr. Mira, As you have not mentioned the duration of your Diabetes specifically, let by your narration my interpretation is you have recently detected Diabetes diabetes approximately one and half month back. You have started on Glycogen Sr 1 gm before dinner, along with you are doing yoga, gym, walk regularly diet control. With all these efforts your blood sugar levels are fairly controlled. I would like to advise_1. Strictly follow Diabetic diet regularly. 2. Continue yoga, gym, walk regularly. 3. Continue Tab Glycogen Sr 1gm after dinner. In fact, you can increase the dose up to 1.5 gm and over another 15 days to 2 gm total per day in divided doses preferred to take after meals. (effective dose is approximately 1.75 gm per day) As this medicine rarely decreases blood sugar levels below normal level (rarely causes hypoglycemia) This medicine act on basic pathology of diabetes called insulin resistance. As Diabetes is lifelong disease, as duration of diabetes increases there may need of additional medicines. 4. You have not mentioned your height and weight so that you should target weight loss according to your height. 5. Certain blood test are important like lipid profile, serum creatinine, HbA1C which denote blood sugar level over period of approximately 120\u00a0days. Urinary protein creatinine ratio, Endoscopy to rule out diabetic retinopathy. 6. You should also start medicine for lowering lipids despite your lipid level, if it is in normal range start in basic dose and if in higher doses according to lipid level. 7. Also, regular BP checking",PCOS,insulin resistance
"Hello Chetna, I am Megha (age 28yrs). I had miscarriage thrice earlier within 1-1.5months of preg. This time, I have been lucky and I am 11weeks pregnant now. My Doc has asked me to use corion 5000 from past 1.5 months and for another 2 weeks(once in 4 days) Also Sugest 200mg, thrice a day, and Glycomet 500SR once a day. Now recently doc asked me to use Duvadilan Retard 40mg as well (twice a day) I had 2 Ultra Scans till now and it was normal. Now the next scan is on 1st feb, based on the results my Doc would provide the medication. My query is","Hello Ms. Mega, All these medications have been used during pregnancy with no reported untoward effects. In view of your past obstetric history, your doctor has prescribed chorionic gonadotropin injections to help sustain the pregnancy until the placenta takes over the function of hormone production. This is why progesterone supplementation also is being used. Metformin is prescribed when insulin resistance is seen as in POD to prevent abortions and gestational diabetes. Nevadian is a uterine muscle relaxant. Please do not worry, you are on the right track. Take care.",PCOS,"insulin resistance, metformin"
"hi mam, im 23 years old got married 3 months. I wanna to get pregnant faster im getting my periods regularly now but minimum flow and getting spotting 15 days back is this an ovulation time? I got pcod 1 year back i took crimson tablets is there any problem to conceive? Pls reply me thank u.","Hello dear, i understand your concern. In my opinion there might not be any problem in conceiving if your cycles are regular. The cause for minimal flow like thyroid abnormalities should be ruled out.Also, as you have a history of POD previously an ultrasound might be needed to check for the POD status. First and most important is avoided stress and anxiety related to pregnancy because they cause hormonal imbalance and delay the conception further. If ultrasound and thyroid profile are normal then nothing to worry. Practice regular intercourse to increase the conception chances. Best regards..",PCOS,"pcod, hormonal imbalance"
I have unregularly period because I have PCOS I had took birth control for 12 months but when I had stopped taking them my period was regular for just three months my 4th one is late now.. I was wondering if I should take something else now ? and if the total fertility supplement PCOS will help in my case ? I will appreciate your kind answer Im really tired because of this ...thank you,"Hi. Treatment for PCs begins with weight loss and metformin, if either or both are indicated, and then is individualized depending on the patients reproductive needs",PCOS,"pcos, metformin"
"dear doc, me & my(28years) wife had sex on December 24, 25, 26(protected).she had her period on January 16-22, a heavy one like regular(no sex in between as we work in different countries) . now in February, she is 13 days late. should we worry about her being pregnant or other health issues? we re not trying for a baby so early in our career.thanks in advance.","Hello, Thanks for letting us know your health concern. If you did not have any further intercourse after your wife had her natural period, there is no need to worry about pregnancy. This delay in menstrual cycle could be due to a transient hormone imbalance often caused by sudden weight changes, stress, infections etc. Please ask her to see her health care provider to detect the cause and plan further management. If the sonogram of the pelvis shows normal study, hormones can be given to induce the period. Hope this helps.",PCOS,pcos
I am 36 yrs and pregnant with 12weeks I have a daughter 11 yrs I have a history of pcod and endometriosis I had a miscarriage in my first pregnancy and it was triplets. both my pregnancy was with treatment but this time with the grace of God I conceived naturally I am being given fertygen injection twice a week progestrone capsule and now asa tablets but yesterday I was bleeding with big clots after scan the baby was fine internal os closed placenta posterior mid segment dont know the reason for bleeding can you please tell me why is this happening and why is asa tablets prescribed in pregnancy I would be very grateful thank you,Hello and Early pregnancy may naturally have periods of episodic vaginal bleeding with clots. This is caused as the baby with the sac in early pregnancy is too small to fill up whole of the uterus. The exposed inner lining of uterus may degenerate and bleed just like a normal menstrual cycle. I am assuming that your ultrasonography after the gush of bleeding showed a live baby with evidence of fetal heart beat. In that case chance of abortion is minimal. ASA or aspirin tablets are given in pregnancy to help in free flow of blood between mother and fetus. Please write back if you have any more queries.,PCOS,pcod
"I take microgynon 30 3 weeks at a time and then break for a week and always get a period during this break. I took the pill for around 5 weeks without a break and now that Ive taken a break from it Ive not experienced a withdrawal bleed and Im getting very worried. Could you offer me an explanation? Ive taken one test and it was negative. Just want to know whats going on with my body, Ive been taking the pill almost 3 years with no problems like this.","HI, Microgynon is a commonly used oral contraceptive. There is a form of oral contraception where essentially it is taken for 3 months so that these women have only 4 periods a year. It is likely that the prolonged use of the medication resulted in the delay you are experiencing. Though it is understandably alarming to you, it is a result of a slight hormonal imbalance and your period will return. I hope this helps",PCOS,hormonal imbalance
"Hi iam 34years. We are trying for a baby for the past 1 year... my periods were regular and my doctor said my ovulation is normal. I had been taking folic acid supplements only. I did foliicular study for about 5 months ina row and everything was normal. Recently my last cycle ended up being an anovulatory cycle. I got my regular periods without any delay. My bleeding was also normal. My husbands reports are normal too. All mu harmonal blood tests were normal, the same month i had anovulation. Is thus possible. What is happening to me?","Hi I think you can take some medicines like camphene for inducing ovulation. Track your follicles' growth by repeated ultrasound and when follicle is more than 17 to 18 mm, take injection for rupture of follicles. Be in contact with your husband every 2 to 3 days after your periods stop. Take progesterone for next 2 weeks after rupture is confirmed on ultrasound. Do a urine pregnancy test after that. You can try like that for 3 to 6 cycles.",PCOS,anovulation
"Hello, Doctor! If I may ask, is there any danger of overdosing on a birth control pill? I took 4 today to catch up. I have PCOS and my doctor advised me to take Diane35.","Hi, Overdosing up to two pills is done to make up for a missed pill, but taking four pills at a time is not going to help make up the missed doses and the cycle is no longer protected. You may also see a breakthrough bleeding due to excessive hormone levels. Other side effects like rashes, nausea, breast tenderness or abdominal pain, apart from vascular disturbances, may also be seen with high doses. I do not think you should be using some other form of pill once you are on Diane 35. You are amply protected if you are regular with your medication. Hope this helps.",PCOS,pcos
"Hi, may I answer your health queries right now ? Please type your query here...hi Im 18 and I have a question about pregnancy. my LMP was july 21st and I havent gotten my period since then. I have a lot of cramps like if my periods about to come but it doesnt. and sometimes my breasts hurt but for 5 seconds and then it goes away. also I feel like Im leaking from down there and I think its my period but its nothing. Ive also taken hpts several times but they all come back negative. also I get like a tingling sensation around my belly button. could I be pregnant?","Hello dear, I understand your concern. The first sign of pregnancy is missed period. And to confirm a urine pregnancy test need to be done a week after missed period for accurate results. The symptoms of pregnancy like nausea, vomitings, increased urination, sore breasts start 2 weeks after missed period. The fetal movements start around 5 months of pregnancy. The chance of pregnancy appears less with your symptoms but confirmation need to be done by urine pregnancy test. If the test is negative there is no chance of pregnancy. So relax. Avoid stress because stress also causes hormonal imbalance and delays the period. Best regards...",PCOS,hormonal imbalance
"Hello Doctor I am 29 year old, going through the fertility treatment. All Hormone test, thyroid test, PCOS test, all seems to be normal. Semen analysis of my husband also shows all normal. Doctor prescribed me 100mg clomid from day 2 to 6 day. but the follicle size is not at all growing, till day 18. after 18th day the follicle size starts growing all of sudden 3-4 mm a day. And on day 21st follicle size became 24mm, My doctor then injected me with injection (I dont remember the name) , but that was for ovulation to occur then on 23rd day I ovulated(As per sonography reports, one follicle from my right ovary got ruptured). for continuous 3 days i had relation, but still I got my period on day 32 of my mensuration cycle. My doctor is now prescribing me to go for IUI. My concern are","Hi, Thanks for your query. I read your query and I understand your concerns. Following is my reply",PCOS,pcos
"Dear Sir I,m problem with Premature Ejaculation within 5-10 Sec I finished my activities because I,m failed So whats I will do I have Diabetics & I will take metformin 850 two times a daily.So please tell to me whats kinds of Indian medicine I will take or whats treatment I already taken before therapy in before also.","Degree understand your concerns went through your details. Most of the premature ejaculation problems are due to anxiety and apprehension, and they are purely psychological. Diabetic induces some tiredness into the system and more anxiety. Most of the people affected with diabetics do complain premature ejaculation in the early stage, and it becomes alright itself later. I suggest you to consult a psychologist for counseling. If you require more of my help in this aspect, please use this URL. http",PCOS,metformin
"Good day Doctor,I am married since 7 years and facing problems in pregnancy. I was diagnosed with PCOD few years back. Now periods happen on time with medication. My endometrium is in proliferative phase. after AMH test result is 1.92 i.e. low fertility. My right fallopian tube is well outlined upto its fimbrial end and shows good peritoneal spillage. the left fallopian tube is not visualised beyond cornua. no obvious spill is noted on left side. i take the following medicines - Clomipure (50) - for ovulation, M2 tone 2tablets twice a day, Myotol F 1 tablet daily and ovigin D 1 tablet twice a day.","Hello. Thanks for writing to us. Since the AMH values are low, the chances of a spontaneous ovulation are low. In addition to the current treatment you need to go for ovulation studies to confirm if there is a successful ovulation after taking these medicines. I hope this information has been both informative and helpful for you. You can consult me again directly through my profile URL http",PCOS,pcod
"hello sir , m a 24 yr old girl and m suffering from hair loss since last 2 years, i went to doc and he suggested me minoxidil topical solution usp 5% along with kevon stay on lotion . i use th solution twice daily 1ml every time , since one week i have been using but no results found , even m lossing more hairs ..... and i have irregular menstruation problem too. so plz help me out frm tis problem.","Hello dear, Since you are giving history of hair fall with irregular menses, you will need a hormonal workup to rule out any hormonal imbalance. If it is found then you will need treatment for the same. Minoxidil increases hair fall initially as it causes the non growing hair to fall out and new hair to grow from the same hair root. You will have to continue with it and should see new hair growth in 3-4 months time.",PCOS,hormonal imbalance
"I have had the implanon for nearly 12months, past 2 months I have had a period every week, only for a few days, it is dark brown, clotty, and causes terrible cramps, I have also noticed my stomach has been bloated (never normally bloated and not changed diet in any way) I am a healthy size 8 so cant put it down to lifestyle. I have been off food, with a constant sick feeling, but terribly thirsty.","Hello, Implanon is quite effective against unwanted pregnancy and its failure rate near about 0.1%. Here, you need to undergo one TVS scan to exclude possible miscarriage. Other reasons are side effect of implant, hormonal imbalance, unnoticed uterine polyp/ fibroid, adenomyosis, DUB, pelvic infection etc. Following initial test, you need to consult with gynecologist for next investigation and suggestive medication. You may need to use other contraceptive method if implant causes that. Maintain genital hygiene. Take healthy diet with iron supplements. Be well.",PCOS,hormonal imbalance
"i suffer from abdominal pain,heaviness and tiredness in the body.when I sleep less my lower abdomen swells and face swells too.I also urinate excessively appox 18 times in a day when i slepp less .and on an average 12 times.i got my thyriod checked .it shows normal. I have polycystic ovary and hence irregular periods.My face looks tired all the time.I am under great mental stress too due to personal reasons.please help",Hi.First we have to find the reasons for polyuria (excessive urination). The probable causes can be,PCOS,"polycystic ovary, irregular periods"
"MY PROBLEM IS THAT ACNE,OILY SCLAP AND FACE,ABDOMINAL PAIN NEAR DATE OF MY MONTHLY CYCLE.BUT NOT CONCEIVE AFTER 1YR MARRIAGE.I HAD VDRL,THYROID,LHS,FHS,LH TVS ETC. ALL TYPE OF TEST BEFORE CONCEIVING.BUT ALL ARE NORMAL AND PCOS IS MILD, TVS TEST SOME LIQUID IS UNDER OVARY THATS IT NOTHING ELSE.I CANT UNDERSTAND WHAT IS THE REASON BEHIND INFERTILITY .","Hello, your Acne, abdominal pain near your menstruation could be symptoms of PCs. Fluids under ovary depends on the time of TVS done. If you had done the scan around your ovulation time, the fluid represents rupture of your follicle(egg), so there is nothing to worry. In case if the fluid persists throughout your cycle then I would suggest a complete check-up of your blood and hormones. But since you have been married for a year and with mild PCs, keep your monthly calendar on check, marking your ovulation (since PCs patient even mild, tend to ovulate at different times) and your post-ovulation till your menstruation time should be around 15-18 days. If its short or longer that could hamper your chances of pregnancy. All together start with a complete hormone check and your partners' sperm morphology, motility and count check.",PCOS,pcos
"Hi, I jus have a question I ve been off depo since August an I ve been having this brown discharge for about two months me an my partner had sex on nov.5 while I still had the brown discharge but then I started bleeding on the 19th so I thought it was my period but then it started to get light an it only lasted for 2 days an when I m on my period it last for 7 days so then I started looking up implantation bleeding on pregnancy an it said that it only last for 2 days an its a pinkish color when you wipe so when I wipe I get a pinkish color or nothing but I took 3 pregnancy test an they were negative so I was wondering if u can help","HI. The symptoms you are presenting with could also appear due to a hormonal imbalance that can occur after getting off the demo shot. This can occur in women until 6 months after getting off the shot, and can present with symptoms like inter-menstrual bleeding, spotting, weight gain, menstrual irregularities, etc. Although pregnancy should be adequately ruled out, especially if you are experiencing a delay in your period, visit a doctor for an ultrasound by the 6th week from your LMP, and confirm/rule out pregnancy. Best wishes.",PCOS,"hormonal imbalance, weight gain"
"Hi, I am TTC. Last I had periods on 1st March,2014. Doctor suggests to take GoodOva Tablet and also CB-Lin, Emrite-500, Thyronil Tablets. I taken Goodova tablet from 6th day of my periods(06th March, 2014). Doctor suggests to have a intercourse between 10th March,14 day to 20th March,14 as I might have ovulation only on those days. But I had my periods till 14th March,2014. After that, We had a regular intercourse till 20th March. I did home pregnancy test on 30th March. But Negative result. I have a few queries","Hi there, , If your period lasted from 1 to 14 March you have had a prolonged bleeding and might not have ovulated in this cycle. Yes, it is possible that some women do not respond to Good ova (Camphene), these could be due to Camphene resistance or improper use. If you have been diagnosed with PCs delayed periods and an ovulation are common, and it could be due to the same that you have not yet got your period. You need to get proper medication for PCs, Metformin 500 mg twice a day is advisable and can be continued even when you get pregnant. It is not advisable to take thyroid tablets unless you have a documented thyroid deficiency, it will not help you to take it randomly. Diet, exercise and Metformin will help you with the PCs. For ovulation induction with Camphene you need to take Camphene from day 2 to day 7 of the cycle and undergo follicular monitoring from day 9 of the cycle to track the ovulation.Also, Folic acid should be taken by any women trying to conceive. You could take Phaeton to get your period and start Camphene from day 2, after confirming with another pregnant test that you are definitely not pregnant. Hope this helps. Regards.",PCOS,metformin
I have a mild pcod I am planning for a baby for last one yr but I consult my gyno 2 months back then I come to know abt this .I am taking chrominac a ..should I able to conceive or not .my age is 32 I have a 5 yr old daughter that time I concevie naturally..,Hello dairy understand your concerned have mild PCs and pregnancy is possible after taking proper treatment. I would suggest taking treatment under the advice of the gynecologist. You can continue chroming as it decrease the insulin resistance. Along with that you can also ask the doctor,PCOS,"pcod, insulin resistance"
"which is good for me. i want preg as soon as possible 29yrs,pcod,irregular periods, taken three month course for pcod after that two months past doctor take USG but not found any major follicle in this. now she recommened another three month course with duloute -L and ebexid. what would you suggest? another doctor recommend ovulation induction drug i.e some clomipine type.?IS this safe for me i am confused .which doctor i had to follow? i want preg soon. if i choose induction drug method Is it solve my problem .otherwise one more month would be wasted.and then i have to follow three month course.",Hello Kyoto; Duolute-L is a hormonal pill and is given to you to make your periods regular and treat POD.POD is one of the cause of infertility because most of the time the ovulation is absent or does not take place and in such cases the doctor advises camphene to induce ovulation. So if your POD is treated and your periods have become regular then you can take camphene for induction of ovulation. So finish your course of Duo lute and discuss with your doctor regarding the use of camphene and take it under the guidance of your doctor. Thanks,PCOS,"pcod, irregular periods"
"i missed my periods since 2 months , i have PCOD, i tested negative for pregnancy , so doc suggested me to take trito n 5 mg tablet twice a day for 3 days , but i din get my periods , instaed i have been tested positive for pregnancy . nw i m 5 weeks 4days pregnant . i was 2weeks pregnant when i took the tablet , now i m worried whether that tablet will have effect on may baby . should i continue this pregnancy or terminate it .","Hello, I have gone through your query and understood the concern. Studies have shown that use of hormones during early stages of pregnancy can harm the fetus if it happens during the stage of organ differentiation, which happens at about 45 days of gestation, or 6 weeks gestation. Any hormone intake prior to this stage, as most often happens unknowingly, has not shown to be harmful. Thus, you are mostly safe since you took the medication very early in your pregnancy and that too, for a smaller period only. Yet, you should test for any possible fetal anomalies and the earliest way available is fetal DNA sampling. Hope this helps.",PCOS,pcod
