Question,Answer,Topic,Keywords
"I m 55 yr. old male who s 50lbs. over weight. I m currently in a pre diabetes range. My doctor just started me on topiramate and metformin to so that I can avoid type 2 diabetes. I m very concerned about the risks in taking metformin. He didn t tell me about a B12 deficit issue or the heart risks. I started taking B12 today. I m scheduled to see him in another 3 months. Another note, due to back issues I m not able to to do much in the way of exercising right now. In time, I will be. With exercise, healthy diet and having lost weight, might it be possible to avoid diabetes without the use of these drugs?","Hiyou get Diabetes once it can be kept under control, but it cannot be cured so keeping your diabetes under control is the best option. Since you are taking metformin it doesn't cause any Heart Attack or vitamin B12 deficiency it may slightly cause some gastritis. it's better to check HE a1c levels in airplane at least 3 months wants to keep your sugar levels under control. Healthy foods and healthy diets can keep your blood sugar under control, but it cannot cure your diabetes. Brisk walking would be the best physical activity for controlling diabetes at least for 30 minutes a day, thank you.",PCOS,metformin
"I usually have irregular periods but for how irregular they are they re still consistently the same length and such. I feel and have felt like i was pregnant for about a month now and last night i had really light pink spotting. Right after i noticed, my fiancee and I had sex that was quite painful. Since then I have had bad cramps and more of a regular flow. Could I be pregnant or did i just get my period late?","Hello dear, I understand your concern. In my opinion it might be just an irregular or delayed period. But if the bleeding is less like just spotting then a urine pregnancy test might be needed. But if the period is normal flow then it is mostly a period. The cause of irregular periods like thyroid abnormalities, PCOD, overweight or obesity, stress need to be evaluated. Avoid stress if any. Weight reduction in case of overweight or obesity is helpful. Best regards...",PCOS,"pcod, irregular periods"
"hai dr i checked my sgpt sgot yesterday the values r SGOT-46,SGPT-55, before this 2month back i checked it was SGOT36, SGPT, 38,iam on medication for high cholestoral atorvastatin since 2 years, last year by september 2011 i checked LFT TEST EVERY THING WAS NORMAL, YYYY@YYYY","Hi, Thanks for your question. As you have mentioned you are on atorvastatin for high cholesterol, There are following possibilities for marginal increase in liver enzymes-1) Long term use of Atorvastatin can cause raised liver enzymes. But your levels of liver enzymes are not significantly raised to stop atorvastatin. 2) NASH (Non-alcoholic SteatoHepatitis) if you are obese it may be possibility. It is associated with insulin resistance. I would like to advise you to repeat your liver function test after 2 to 3 weeks, if liver enzymes rises further consult your doctor for detailed clinical examination and if required further evaluation. Hope this helps you, if so do vote as helpful.",PCOS,insulin resistance
hello dr i m 30 yrsoldi hadamiscarriage in 20 weeks due to c0rd prolapsein jan 2011 sincethen i havemy regular cyclesbut now i want conceive again so i went to thedr shesuggested me to haveclomididid but i didnot conceive i m very eager to fill my loss and conceive plz giveahelpful suggestion thank umy height 5.6 inchesand my weight is 90 kgs,"Hi, If you didn't have any menstrual issues from the beginning. Take 3 months course of oral contraceptive (under your gynecologists care). This will clear hormonal imbalance caused by the abortion you will start getting ovulating cycles. Try for conception after 3 months course of pills is finished. Husbands semen analysis should be checked while you take three months of treatment. your investigations (ovulation study tubal patency test)are advisable in case of history of fever, pelvic inflammation after delivery. Thanks.",PCOS,hormonal imbalance
"I am on bio-identical hormones and my testosterone level has gone from 62 to 247 in the last 8mos. My GYN has finally told me to stop the testosterone for a while. I ve been having abdominal pain and now lower/upper back pain for the past 3mos. Had ultrasound last wk and it came back showing uterus is anteverted, small hypoechoic foci likely respresents fibroids measuring 8mm. As well as a 1.5cm right ovarian cyst containing some internal debris and a 1.3cm simple left ovarian cyst. Can this be a result of the high testosterone? And is this something to be concerned about? And will these go away on their own?","Hi, How old are you? Why your taking testing? Are you suffering from poor sexual functioning? Are you postmenopausal women? Suffering from osteoporosis? Psychological symptoms such as depression? Supplementation may elevate the testosterone don't worry. Ultrasound abdomen also normal. Single cyst in ovary ok. But fibroid in uterus is symptomatic then you have to consult your gynecologist she will examine and treat you accordingly. Hope I have answered your query. Let me know if I can assist you further.",PCOS,testosterone
"hello doctor.... iam sita 25 living in chennai,having irregular periods for because of PCOD problem. so, my doctor suggest me to take Duoluton-L tablet... iam going to get married on december 2013.... will my periods get regular and will i get any problem after marriage. we are planning to get child within a year.. will it affect to get pregnancy","Hello, It is definitely a problem for a PCs patient to get pregnant but not impossible and a sustained effort will definitely bear fruits for you. The most important treatment for you at the moment is to regulate your menstrual periods, which you are already doing with SOLUTION tablet and other important part of treatment is to do regular aerobic exercises for at least 45 minutes a day and reduction of weight. It is said that a mere reduction of 10% of your weight can result in regularization of your periods. Once you get married, then different treatment is started for ovulation induction. Be under the care and advice from your treating doctor now as well as after your marriage also. Thanks",PCOS,"pcod, irregular periods"
am married since one year i have endometriotic cyst in left ovary. wat r d chances for pregnancy. wat type of treatment should i undergo. are there any specific food which should be avoided during pregnancy plannning. am anxious to conceive but its always been unsucessful. the rupture of follicles are healthy in the other ovary..please advice,"Hello, You can have all foods, no exceptions. You should remove your endometriosis cyst to get pregnant because hormonal imbalances will occur. After removing the cyst you can get pregnant easily. There is more chance for getting that cyst again. Cyst will cause you more pain it can be intolerable during your periods. Hope I have answered your query. Let me know if I can assist you further. Regards",PCOS,hormonal imbalance
"My height is 1.62, Blood group O+, I am 48 years. Have two abortions. Have no child. Have not seen menstral period since February, 2010. My husband has low sperm problem. Can you help us in place of advice.","Hi I have gone through your question. As amenorrhea has so many reasons like1 hormonal imbalance 2 uterine pathology. So I would suggest doing hormonal study, thyroid profile, ultrasound of pelvis. For your husband I would suggest semen analysis for low sperm count. Then consult your family physician for further management plan. Hope I answered your question. Would be happy to help you further. Take care.",PCOS,hormonal imbalance
"One or two days before my period, my left foot burn, tingles and ache a lot to the point I can walk on it. Once my period start the pain decreases and disappear. I have also noticed some bruising on the lower left leg right above my ankle which is sore to the touch.","Hi Dear, Understanding your concern. As per your query you have burning sensation and tingling in foot before periods. Well there can be many reasons for symptoms you mention in query like radiculopathy, cervical spondylosis, herniated disk, peripheral neuropathy, neuralgia, multiple sclerosis, vitamin B12 deficiency, hyperparathyroidism or hormonal imbalance. I would suggest you to consult gynecologist for proper examination. Doctor may order blood test along with other test to confirm the diagnosis. Doctor may give hormonal therapy or refer you to endocrinologist for thyroid problem. Hope your concern has been resolved. Get Well Soon. Best Wishes,",PCOS,hormonal imbalance
My wife starts getting short of breath even while walking at a relatively slow pace. I estimate she takes about 8-12 breaths every ten seconds. She also feels dizzy while doing things around the house. She has gained quite a bit of weight over the years but her blood pressure is normal as are her cholesterol levels. I noticed the other morning that her respiration while sleeping was very rapid and labored. Our family doctor thought it is due to her nor drinking enough fluids but she has been drinking normal amounts every day for the last several weeks.,"Dear, she has very fast heart rate. It should be immediate concern. As you have not written her age so I have to take few possibilities. Fast heart rate with breathing discomfort could be to some infection in body or lungs infection (fever is usually present), Heart diseases (dizziness is also seen) or some metabolic diseases (thyroid hormone imbalance). Weight gain is also seen in metabolic diseases or when your activity has been reduced due to some disease or fluid retention in heart diseases. She needs immediate attention by internal medicine or good GP.",PCOS,weight gain
im 3 month pregnant and i feel cramping and what it seems to be pressure on my upper stomach right below my chest. I have not met with a DR to check my health or the Baby s because i just found out yesterday. I sometimes feel supper bloated when i finish eating a whole meal. my question is why am i cramping and feel slight like poking in my stomach?,"Hello misunderstand your concern. I think it is due to preparation of uterus for pregnancy that produce cramp. Bloated may be due to the hormonal imbalance that produce reflex, and you feel bloated. Other cause of cramps may be",PCOS,hormonal imbalance
"hi I m trying to conceive and my gynec priscribed me ovofar 50 mg 1st cycle I took it from 3rd to 7th day and I got my period in 22 days, then I took ovofar again from 3rd to 7th day and this time its 37 days and cant see any signs of periods and home upt tests are negative.(took 3 tests in last 5 days) latest one was few hrs back. I am having crams since last 1 week (which I usually get 1 day before my periods or during 1st and 2nd day ) not constant or everyday but randomly. can taking ovofar delayed period? or affect upt? please guide I m confused","Hi there,The symptoms irregular periods sometime sometimes short long is more due to an-ovulation, due to hormonal imbalances. The ovular is to correct that. You probably have PCs, which is causing the irregular cycles and which is why the doctor has prescribed you the ova for. You need to first get completely evaluated for PCs before proceeding with the treatment. I would advise you to get the blood tests such as FSH, LH, TSH and prolactin done. These will help determine if the cause of irregular cycle and infertility is them. You also need to do ultrasound pelvis to check for problem is in ovary and womb. Your partners' semen analysis is also necessary to get a complete picture. Kindly do the above tests and discuss with your gynecologist. If PCs is diagnosed by blood tests and ultrasound, medications such as metformin need to be started. Hope this helps. Regards.",PCOS,"hormonal imbalance, metformin, irregular periods"
"hello sir i am suffering from poly cyctic ovaries disease n grade 1 fatty liver n both ovaries are enlarged in size im now 27 years old married female . now i want to concieve . my DR. adviced me to take obimet*sr 500 tablet 2 tablets per day , n also i m having irregular menstural cycles n thyroid problem , im taking thyronorm 25 mg per day. can u please suggest me , is there any complications to concieve or what?","Hello, Poly-Cystic Ovary Disease (POD) and fatty liver suggests that you may be overweight or obese. Both the disease are more common obese person. Irregular menses are also common in obese female. Poly-Cystic Ovary Disease (POD) is a very common cause of Infertility. The rate of female obesity is associated in at least 30% of cases with POD, even up to 75% of case in some regions of the world. Obesity related Insulin resistance along with female hormone imbalance is one of underlying cause of it. Weight loss is the cornerstone of the treatment of obesity-associated infertility. Lifestyle changes that encourage weight loss, including dietary modification and exercise should be started. Metformin help to improve insulin function. Bariatric surgery (weight loss surgery) is advised for morbidly obese (very, very obese) female. Once target weight loss is achieved, fertility rate (chance to conceive) improves. Target weight loss achieved by any mean (diet, exercise or surgery) help not only to conceive, but also decreases the complications to baby & mother during pregnancy and during delivery. Once you lose weight, your fatty liver also improves and becomes to normal literate a good health",PCOS,"insulin resistance, metformin"
hello! i had my period on the first week of september and it lasted for 5 days! 2 weeks later i got my period again and it lasted 3-4 days. does this mean im pregnant? i have been trying to concieve for almost a year now. what can i do to help me conceive?,"Hallow Dear, Frequency of period is not a sign of pregnancy. It could be due to some hormonal imbalance like Oestrogen-Progesterone and/or Thyroid. If this has happened only for this time, you may wait for a couple of cycles. If the irregularity persists, you will have to get investigated for your hormonal profile by blood examination for FSH, LH, Prolactin, Estrogen, Progesterone, T3, T4, TSH, and any other if indicated. For that you will have to report to the Gynecologist. Such irregular menses are usually without egg release. If you are keen on getting pregnant, better get your status of ovulation (egg release) assessed. You can do that ultrasonography ovulation monitoring also. Hope this helps you,",PCOS,hormonal imbalance
Im an unmarried 23 yrs old girl and im having Pcos...My doctor have prescribed me Rejumet 1000 for 6 mnths..will it be effective?? Does the polycystic ovaried will be cured after 6 months?? In future wil there be any problem of me getting pregenant? Pls help me out?,"Hello dairy understand your concerns is very complex disease and treatment response is variable. It causes hormonal imbalance, insulin resistance, weight gain and menstrual irregularity. Treatment should be taken under advise of authorized gynecologist after proper investigation. Rejumet will decrease the insulin resistance and induce the ovulation. But it should be taken along with medicine likeProgesterone pill in the second half of the period birth control pill",PCOS,"pcos, hormonal imbalance, insulin resistance, weight gain"
hi i was taken levlen ed and i stopped taken it on sunday the 4th of august im trying to get pregnant ive had unprotected sex ever since.ive had a little bit of bleed since wednesday more like spottingis there still a chance i can get pregnant within this monthi feel like ive got some of the signsi feel sick in the morning and sometimes through the day but not throwing upi more tired than normalcraving one certain foodn one of my favourite foods didnt make me feel wellso i was just wondering is there a chance?,"Hello, Leven ED is low dose oral contraceptive pill. After stopping the pill, fertility is regained within 1-2 months. Mild spotting after sex may be due to blunt trauma or hormonal imbalance. Pregnancy depends on proper timing of unprotected sex and ovulation or fertile days. Here, you need to wait for next coming period. If it is missed, you have to do a home pregnancy test. Blood test is more confirmatory. Hope, it helps. Good luck.",PCOS,hormonal imbalance
"Hi. I had a plexiform fibrohistiocytic tumor removed from my collarbone when I was 12 years old. I have been to MRI scans each year until I was 21 years old. Should I continue going for scans? I have been disgnosed with PCOS, but something tells me that it may have been the tumor that has spread? Am I being silly or shiuld I notify my doctor? I am 27 years old now.","Hi, dairy have gone through your question. I can understand your concern. You had pluriform fibrohistiocytic tumor. Your PCs has no relation with your tumor. You should take treatment of PCs. No need to go for scan every year. If you don't have any visible lump or other symptoms then you can go for scan every 3 year. Hope I have answered your question, if you have doubt then I will be happy to answer. Wish you a very good health.",PCOS,pcos
"Hi I am 20 years old.. and on 19th September, 2013 my boyfriend had rubbed his penis on my clitoris.. he was wearing his underwear.. i had got my periods on 8th September for 5 days.. den directly on 7th December i got spotting.. so i went to doc.. doc told me to do ultrasound of pelvis where it shows m diagnosed with PCOS and uterus is normal and doctor suggested me to take Oosure tablet and on 27th December i got periods with normal flow for 5 days.. and now doc have have suggested me to take yasmin.. i usually get periods after 2 3 months.. i am very scared now can anyone plz ans Am I pregnant?","Hi, Thanks for the query. Poly cystic ovary disease usually presents with irregular menstrual cycles, an ovulation, insulin resistance etc. So your previous irregular periods could be due to this. According to your history, the possibility of pregnancy is less. As you got periods after the incidence and as the ultrasound showed normal uterus, they almost rules out the possibility of pregnancy. Yasmin are combined oral contraceptive pills. They help in regularization of menstrual cycles by correcting the hormonal levels. Possibly by using the pills for two to three months your cycles may get regularize. Take care.",PCOS,"pcos, insulin resistance, irregular periods"
"Hai doctor I am 22 year old and my husband 26 , I am suffering from pcod but I have a normal ovulation and regular periods . A detailed semen analysis of my husband shows sperm count -10millions, active motility -10%, sluggish motility 40% dead -50%, morphology 15% . according this report how much chance to get pregnant","Hello, Thanks for the query to H.CM. Forum. Let me explain to you the fertility and infertility. Normal fertility associated with > 48 million /mL sperm counts (in your husband case it is 10 million/mL). Motility more than 63 % with > 13 % normal morphology. Sub fertility associated with less than 13 million/mL., motility of In my opinion consult a sex specialist and get his opinion as sperm count is less. Good luck.",PCOS,pcod
"Hi, I have been TTC for 1 year and 5 months now with no luck. My doctor is an HSG and all of my tubes were open. I have very low progesterone, last test after provera induced menstrual cycle and Clomid on days 3-7 results came back at 0.4; the doctor said anything under 10 for progesterone is considered too low. I am now on Metformin 500mg. I was taking it 2x per day up until last Thursday, now I have been taking it 3x a day going on day 4. I finished provera 10mg for 10 days 8 days ago now and still have no sign of a period? Also, I have been noticing an odd odor during urination and bad cramps in my stomach followed by a burning sensation in my vagina. Any idea what the cause may be? Please help? Thank you!","Hi, Thanks for the query. As you are not getting periods even after progesterone challenge, there is possibility of both estrogen and progesterone deficiency. So you better consult your doctor and go for combined pills to induce bleeding. And also there may be some vaginal infection as you are having pain abdomen, burning in the vagina etc. Get examined to rule out the infection also. And if there are any signs of infection go for antibiotic therapy. For more details you can ask me through",PCOS,metformin
I had my periods on sep 14 and I had sex with my boyfrnd around 10 days after periods.even though he didnt ejaculate inside vagina I took ipill with in 24 hrs for safety .we did sex only one time.we didnt go for a second shot.now my periods is delayed 5 days than my normal cycle .am I pregnant?,"Hi, I understand your concern. I pill when taken within 72 hours of unprotected sex, avoids pregnancy. Earlier the pill is taken better are the results (protection)You had taken it within 24 hours of sex. So you are sure to avoid pregnancy. I pill is a high dose hormone product. It acts by postponing ovulation. So there is hormonal imbalance in cycle & periods are delayed by 8-10 days than normal. Please do not worry. You will get period in next week's time. Thanks.",PCOS,hormonal imbalance
I have some ovarian cysts which causing the problem in pregnancy. My doctor has advised me for GLYCIPHASE 850 mg daily two tablets. I want to know the side effects of this and how will it help in pregnancy?age,Hi I think you have a PRO problem. In this condition periods become irregular. The glyciphase medicine is given to regularize the periods. It helps in some cases. Regarding side effects it can reduce the sugar levels sometimes. So you can check your fasting and post breakfast sugar levels at regular intervals. It helps in decreasing the insulin resistance which is one of the causative factor in PRO patients. It helps in ovulation. So it can increase chance of pregnancy. Hope I have answered your question. If you have any other query I will be happy to help.,PCOS,insulin resistance
my gyne told me in march 2011 i have pcos but my periods are normal so i changed my dr and i had an ultra and vaginal scan and was told that there no signs of pcos do you still have pcos without cysts and what can i do to help my problem to have another child. thank you!,"Hiiii, There may be multiple functional cyst that may be not harmful to ovulation. As you do second time scan and there are no signs of PCs, then you need not be much worried.Also, you have normal period. You are trying for 2nd issue. Do sex around ovulation time. Also do a fresh semen analysis for husband. Show the all test result and consult further. Take fiber and protein rich diet. Do light exercise and sleep well. Have a good day. For more suggestion, mail [email redacted]",PCOS,pcos
I am 54 female. I have a red lump on the underside of my breast that turned dark purple/blue color. It is hard yet rubbery feeling and now the skin has come off. I was diagnosed with pre diabetes last year and I am supposed to take metformin 2 times a day but I am not good at remembering to take it. I had a mammogram and the radiologist thinks it is cellulitis and my gyn has put me on a second round of antibiotics. I am worred about cancer or an infection going to my organs. I need reassurance.,"Since you are a diabetic you need to maintain strict medication and diet restriction to maintain sugars under control. Infections are very common in uncontrolled diabetes and need prompt treatment. You said the skin over lump is red and is peeling of. All these point towards infection has strong possibility, and it would subside with appropriate antibiotics. Please remember all breast lumps are not cancerous",PCOS,metformin
"hello dr . my age is 25 . i have PCOD issue . before marriage my dr suggested to take orgamed i took for 7 year till now its not regular . after marriage she asked me to take rubella vaccine and contraceptive pills for 3 months again i had cysts .dr suggested me to take clome , duphaston ,glycomet . will it successfully to get pregnant ?","Hi, PCOD is complex disease and treatment response is variable. Once your period become regular chance of pregnancy is high. You are on correct treatment. Come, Phaeton and Comet will help you to become pregnant. Clonidine citrate",PCOS,pcod
"Sir, My age about 60 year is suffering from skin allergy or skin problem since last 8 years in which her skin become patchy and ( starts severe khujali in her arms and face) I have shown to many doctors, some say that it is allergy with gajar ghas and some say it is internal problem it can,t be healed and some say it is life long and it cannot be cured . In Jabalpur I also shown to Skin Specialist ,he gave treatment but after some relief it again reappear and the problem is as it. So ,i request to sir kindly guide us for the treatment of the same.","Dear Mr MHRA, If your skin comes up in hives or circular red itchy lesions (with central clearing) that disappears on its own or after medications (usually antihistamines) in a few hours, you are most likely suffering from a condition called urticaria. This can also manifest with swelling under the skin or swelling on lips and tongue called angioedema. This is due to histamine release that may be spontaneous or a secondary trigger like scratching (physical), cold or heat (temperature change) or related to hormonal imbalance. Conditions such as diabetes, underactive thyroid, or other autoimmune diseases make it worse when they are uncontrolled and a proportion of patients with urticaria have autoimmune urticaria while in others it may be idiopathic. High-dose long-acting antihistamines for 3 months (minimum duration) may provide extended relief when stopped but may need to be continued for longer. Fexofenadine 180\u00a0mg and cetirizine 10\u00a0mg twice daily is the usual choice. Thanks.",PCOS,hormonal imbalance
