Question,Answer,Topic,Keywords
"Hi, My name is Angela Chapman and I have hyper pigmentation around my neck, thighs and some under my breast, lower stomach. I am obese, and I also have a disease of PCOS ( Poly cystic ovarian syndrome ) The doctor told me the only way to get rid of the dark spots is by losing weight, offered me some treatment of Tretinoin Gel, 0.01%. I have used the Gel before around my neck, I have never gotten a reaction from it! It actually lighten up the skin around my neck, made some of the dark spots go away. I have been working out, trying to lose weight by taking Metformin to prevent the high level of insulin resistance on my neck. I just recently saw a doctor again bc I moved out of state, my prescription was over due. I had to get another prescription note, when I went to pick up my medication from the clinic. They screwd up and gave me Tretinoin Cream, it s 40 g. It some how made a reaction on my skin, made me break out in a rash, it itches around my neck, thighs. I have really really bad dark spots in between my thighs, and I m trying to get good skin. But the doctors I have been seeing in the past have been screwing up on my body. I had a cyst in my right ovary before, it was huge. Instead of going through the surgery they decided to put me on different birth control pills to help dry out the cyst in my right ovary. The cyst was to big to dry out, so I had surgery done. They did a larparascopy on me, and a DNC with getting the polyps in my body, they also stuck a IUD ( merina ) inside of me which made me gain a lot of weight. Luckily, after that happen I was okay but after that the IUD popped out of my uterus wall because of being heavy weight. After being on so many different birth control pills I had no idea that the oral contraceptives causes discoloration in the skin. I was also on the Yaz, Microgestin FE, IUD, Depo prover shot, Prover pills and some other that I forgot. The abnormal bleeding stopped, and I stopped with taking the oral contraceptives. But it damaged the skin cells in my body, and I wanted to know how to get rid of it. I have been diagnoised with Ancanothis Nigerican which is related to my pcos. Do you have any suggestions of how to get rid of the dark spots on my neck? I never had it this bad but after using the tretinioin cream it made me break out in a rash, it itches. The itching in between my thighs went away but after I stopped using it. It gotten a lot worse in between my thighs. Any suggestions of what to use to get rid of the itchy, the hyper pigmentation in between my thighs? I have taking fish oil supplements, that has been helping a lot as well!","Hi, Thanks for the detailed information provided by you. The pigmentation around the neck, thighs, breast abdomen is Pseudo acanthuses Nigerians. There is no damage to skin cells after taking contraceptives. It is related to obesity. So the best way to reduce this pigmentation is weight reduction. Creams like retinoid may be used to reduce pigmentation. Tretinoin can cause hypersensitivity reaction in the skin in the form of itching and rashes as has happened in your case. You may stop applying retinoid cream and apply a moderate steroid like comatose for a few days, this will help in reducing redness and itching can be taken care of with an antihistamines. You may continue taking fish oil supplements. After the rash disappears you may restart retinoid gel 0.01 % for 2\u00a0hours, slowly increasing the duration if no rashes appear Hope this helps you",PCOS,"pcos, insulin resistance, metformin"
"before 2 years i hve misscariage 3 month,then my dr are not recomend d n c.last 1 year i want to conceive bt m fail to get pregnant.my dr says i hv pcos problem i use ivf treament and other more bt m not pregnant.now plz tel me what i can do m very disappointed,plz help me....plz saira","Hi I think you should go for evaluation first. Get a thyroid profile and prolactin level done. You can track your follicles' growth by repeated ultrasound and when follicle is more than 17 to 18 mm, take injection for rupture of follicles. Be in contact with your husband for 2 to 3 days after the injection. Take progesterone for next 2 weeks after rupture is confirmed on ultrasound. Do a urine pregnancy test after that. You can try like that for 3 to 6 cycles. Hope it helps. If you are not ovulating, you may need some medicines for that.",PCOS,pcos
"Is there any specific day of ovulation due to Fertyl-super intake Is there any specific day of ovulation due to Fertyl-super intake prescribed as I was diagnosed as PCOD and did not get pregnant for couple of months when tried. I have taken this tablet from day 3 to day 7 and I am now on day 8. Should I use OPK, if yes then from when and if I get +ve then when would be the best time for intercourse.","Hello, The ovulation induced by ferry occurs about 5 to 7 days after the course of tablets is completed .you are now on 8th day. So you can now use OPK. If you do not test every day from before you expect to be most fertile, you may miss the LH surge. Testing daily once you have started to test is the best strategy since your first positive OPK result probably means that you are about to ovulate and your last positive OPK, if you get more than one, may mean that you just ovulated. First morning urine is usually not the best for Oaks. Late morning or early afternoon is usually best ONCE YOU KNOW THE OVULATION, maintain sexual relationship during the period at least for 2 to 3 days, which will increase chance of pregnancy. Thanks for query. Take care",PCOS,pcod
"Hello, Im 29 married weighing 72 kgs, height 5\"". My gync has ask me to go through Adv USG Pelvis scan. My menses are irregular. Im trying to conceive. I had a abortion done 2 yrs back. and have gone for clean up also. Is there any serious problem. Why is this scan recommended. Also can i conceive easily or will there be problem in the same. Jyoti Hello, Im 29 married weighing 72 kgs, height 5 . My gync has ask me to go through Adv USG Pelvis scan. My menses are irregular. Im trying to conceive. I had a abortion done 2 yrs back. and have gone for clean up also. Is there any serious problem. Why is this scan recommended. Also can i conceive easily or will there be problem in the same. Jyoti","If u have irregular menses then the doctors ask for normal USG Pelvis Scan .even I had irregular periods.n after 3 yrs of marriage couldn't conceive so my Gino asked me to go for the scan. In which they showed some ovarian cysts.which they call it as \""POD\"" Polycystic ovarian disease. don't panic .just go for the scan .u ll come to know what that is. If u also have cysts then u might be suffering from POD.or else if not then your irregular menses could be due to the hormonal imbalance...for which the doctor will give you some hormones instructing tablets and your periods would be regular. And you can conceive very easily . All the best",PCOS,"hormonal imbalance, irregular periods"
age 23 years female married respected mam 6 months have been passed being married .still im not pragnant.my menstrual cycle from april is below. 27 april 6 june 19 july 7 sep 12 oct am i suffering through irregular cycles? plz help me how can i be pragnant,"Hello dear, I understand your concern. In my opinion after seeing your dates of your cycles they seem to be irregular. The causes for irregular cycles like thyroid abnormalities, PCOD, overweight or obesity or stress need to be ruled out. Ultrasound and thyroid profile are helpful to diagnose the above conditions. Weight reduction in case of overweight or obesity is helpful. Avoid stress. Best regards...",PCOS,pcod
"I get large lumps on my spine, back of my head, neck whicChatDoctore and go every month. Sore to touch. I suffer with hirsutism and have been seen by an endocrinologist who says my androgens are \""in normal levels\"" the lumps last about a week every month.","Hi. Thanks for your query and an elucidated history. This looks to be due to furunculosis, / boils. This is due to failure of the skin to adapt to the hormonal changes as you have rightly noticed. Yet you can try this",PCOS,"hirsutism, androgen"
"hi doctor,,i had anal sex few days back,while attempting to push his penis ,he by mistake went into the wrong direction.he got his part rubbed into mah Gpart..then we had a protected sex with a condom.In order to safeguard i had a pill next evening..but,still it had been 5 days and i didnt have my periods yet..am i pregnant?","Hello dear, I understand your concern. In my opinion the chance of pregnancy in your case is very rare. Because it was protected intercourse with condom and emergency pill was also taken. Emergency pill is 95% effective if taken within 72 hours of intercourse. The emergency pill causes hormonal imbalance and effects the timing and bleeding of the period. So the period can be either delayed or come early and bleeding can either be heavy or irregular or scanty. So relax the delay in period could be due to pill. I suggest you to do a urine pregnancy test a week after missed period. If the test is negative the delay can be due to pill. And wait for spontaneous onset of periods. But overall the chances of your pregnancy are very, very rare or nil. Avoid stress. Nothing to worry as such. Hope this helps. Best regards.....",PCOS,hormonal imbalance
"i am 27 years old and will complete 2 years of marriage in august. i am planning for a family since a year,but results are negative. my menses are irregular and have to take medicine fo most of the time to get menses. i go for a checkup and doctor says utreus is small. and today i go for checkup again same result. i am worried,i would like to know whether i will be able to conceive or not. please help me out","Hi, I have gone through your question and understand your concerns. Irregular periods can be due to hormonal disturbances like hypothyroidism, hyperprolactemia or polycystic ovarian disease. These three are also the commonest cause for infertility. I would suggest you to consult an infertility specialist to get properly examined, investigated including hormonal profile and ultrasound and get appropriate treatment. Hope you found the answer helpful. Wishing you good health",PCOS,irregular periods
"I m 33 yrs old and in my day 60 since my first menstruation. I am diagnosed with PCOS and my cycle is irregular. I took the urine pregnancy twice, day 46 and day 39, and they were all negative. I took up Duphaston on day 47 and today is my last intake. A month before my last menstruation I took up Puregon and Pregnyl. My doctor advised me to undergo transvaginal and here is the impression Normal sized retroverted uterus with thickened endometrium . Nabothian cyst, posterior cervix . Normal ultrasound of the ovaries. Clear adnexae. My doctor said that it is still to early to know if I m pregnant and I have to wait for two more weeks to be sure. Is it possible that I m pregnant? Would my Nabothian cyst post a problem or may be the cause of my menstrual delay? Thank you.","Hi, Nabothian cyst isn't going to be a problem with the pregnancy and it's not the cause of the menstrual delay. The late menstruation could be due to PCs or in case of pregnancy. If you have missed a period, and have had regular periods in the past, then you can wait a week and take a test. If you have had irregular periods from before, then it difficult to estimate the dates. You should wait awhile and take a test.",PCOS,"pcos, irregular periods"
Hi i am sudha.i am 26yrs old.i am married for 6 months.i have 44 days of amenorrhoea & preg card negative..Before marriage my hormone levels are normal.my USG-abdomen &thyroid profile normal.my Gynaec doc diag me as pcos due irregular periods &hirsutism .i had Diane 35 for 4 cycles.now my cycles are 30-32 days.i have started meprate 5mg tds for 3 days.i am eager to get conceive. help me.,"Hi, I understand your concern. Once your period becomes regular then it will increase chance of pregnancy. You can become pregnant after stopping Diane 35, as it acts as contraception. You should ask following medicine to conceive",PCOS,"pcos, hirsutism, irregular periods"
"hi, i just wanted to know that i had i pill on 27th feb n after that little bleeding came n now m feeling that my periods are started so can i take meftal spas rt now? why this little bleeding came, does it relate anywhere to pregnancy? should i take meftal spas every month coz i cant bear it without that even my bp goes low n lower abdominal pain is untolerable? plz help me....","Hi. Meftal spas is taken during menstrual pain and is one of the indications for it. Bleeding after the i-pill may be due to hormonal imbalance i-pill creates. You can take Metal spas for any pain in abdomen. But it is better that you take the medicines only if there is pain, otherwise there is no role. It is better to avoid i-pill as it looks that i-pill is not suitable to you and your hormonal balance. Better to take condom or use safe period for sexual intercourse.",PCOS,hormonal imbalance
"hi!I am 27yrs married woman.. i have my periods every 29-30 days...a day before my periods i get a brownish discharge & the next day my period starts but its scanty..but painful( ive always had painful periods),d flow is red bt scanty..it lasts for 2 days & then from the 3rd day i might have a red spot or not..this lasts for 5 days...what is the reason for this?my thyroid tests are normal..I ve been trying to conceive for the past 2 years..","Hi sadiqa786, your periods are not heavy and the flow you have described may be normal. The pains that you experience could be due to varied reasons most commonly may be due to polycystic ovary disease, pelvic inflammatory disease, endometriosis or no explained cause. As you are also trying to conceive it would be best to visit a gynecologist and get yourself evaluated for the same and during the course of investigation they will be able to find any cause for dysmenhorria(pain full periods) if any. In the meanwhile you could start doing some exercise or yoga to keep yourself fit and to lose weight if you are overweight. Yoga helps in receiving cramps and helps in decreasing pain during periods. Take care!",PCOS,polycystic ovary
"Hi,I am a diabetic for the last five years.. There is family history.. I am 65years old and a female of Indian origin, living in malaysia.I would like to know about the drug Gemer P2..how do I take it? When do I take it? How much? What are the side effects?thank you, SULO.","Hi,Gemer-P2 is a combination of three anti-diabetic medications glimepiride (2\u00a0mg), metformin (500\u00a0mg), and pioglitazone (15\u00a0mg). These medicines are also available in the brands like Tripiride-2, Gluconorm-PG2 or Film Plus-2. If not available you may request your doctor / pharmacist to prescribe individual medicine as mentioned above. Hope I have answered your question. Let me know if I can assist you further.",PCOS,metformin
"Hello, I have had slowly increasing mild elevations of liver enzymes over the last 9 months when they were initially discovered.I had taken venlafaxine 300mg and mirtazapine for 20 years for severe OCD. The previous 5 years I have had chronic fatigue syndrome which has been incapacitating for the last two years in particular with symptoms of ibs symptoms, extreme fatigue, mental fog and back pain.Depression and OCD has worsened also.Since the elevation of the liver enzymes I have changed medication to fluoxetine as venlafaxine was believed to be the cause of this but mental health is worse and no improvement in liver tests I am a 40 year old woman with pcos.My current alt levels are around 70, ggt 180,alp 134 and have had slow steady increases. Ultrasound showed only slight fatty changes.Do you think my worsening exhaustion could be partly related to liver?Should I have any further investigations for this before change in meds? Thank you.","Hi, His light fatty liver changes are a normal finding after an age of 40 years. So don't worry a lot about them. Though liver function tests are deranged, yet they are not that deranged that they cause fatigue. Fatigue and feeling of exhaustion are because of Fluoxetine which you are having for your OCD. Abnormal liver function tests were most likely because of Mirtazapine. Don't go for any further medication just ask your psychiatrist for few latest SSRIs like Paroxetine which are much safer and have significantly less toxic effects. Liver rejuvenated like Sylvain can be taken for 3 months to improve liver functions. Hope I have answered your query. Let me know if I can assist you further.",PCOS,pcos
"hi i have a question, my period this montChatDoctore on two days late and it only lasted maybe a day or a day and a half and was very light. i had a peagnancy test done 5 days ago and it said negative should i go get another one done at the health department? could i still have a chance at being pregnant?","Hello dear, I understand your concern. In my opinion the delayed period with scanty bleeding needs to rule out pregnancy. As the test is negative the chances of pregnancy are rare. I suggest you to repeat the test after a week. If the repeat rest is also negative the pregnancy is ruled out. And the abnormal period can be due to hormonal imbalance due to stress or any. But if this sort of abnormal period continues every month then thyroid abnormalities, stress, overweight or obesity should be checked and treated. Nothing to worry. Best regards...",PCOS,hormonal imbalance
"hi ive had marina coil in for nearly 3yrs,i have pain in left side of abdomen ,not constant pain just stabbinghere and there for bout a week now,i had intercourse the other night and had pinkish blood when i wiped,but havent had periods since fitted with coil,i dont feel right down there,and wouldnt know what to feel for to check if coil moved etc","Hello, If the coil is in place, you would know by checking the threads through the vagina. If you can find them by palpating with your fingers, it means that the IUD is in place. Spotting after intercourse could be due to an unhealthy cervix with some cervices or an erosion, vaginitis, a polyp of the cervix or endometrium or some hormone imbalance. A local exam should be done to clarify. To know what is causing all these symptoms, you should get a trans-vaginal sonogram and if needed, a pelvic MRI to know the location of the coil. Hope this helps.",PCOS,pcos
"hi, i have pcos and i was wondering do you ovulate with every period because i have a period every month, i have known i have had this condition for four years and in that time i have only missed at the most 6 periods, does this mean i have a good chance at getting pregnant naturally?","Hello, I have gone through your query and understood the concern. It is possible that one can have regular cycles even without ovulation. It is also possible that one can have irregular ovulatory cycles in POD. Since you have a good cycle status, You have good chance of conception as the chances of establishing ovulation are good. Please see an infertility specialist for proper management. Hope this helps.",PCOS,pcos
"Hi doctor i have a big question Okay so me and my boyfriend were trying to get pregnant for a while we have tried 3 times and fail this last time we tried was weird my last period was on December 28 2012 I supposed to get my period at the end of January or so but I didn t I was late for 3 weeks and got it on February 13, 2013 for 4 days which was weird cuz my period always last for 6 or 7 days and yes it was dark red like normal when are my fertility days to get pregnant? This last time we had sex when he got up of me something was leaking it looked like water I don t know if it was his sperm or it was me please help me!!!","Cellophane you for your query. The leaking fluid you describe is seminal fluid, which liquifies after some time, and might appear watery. Regarding your fertile days, if you have a regular 28-day cycle, ovulation occurs on day 14, so for 2 days before and after it, are your fertile days. If your periods are irregular, you cannot count the fertile days in this manner. You should use Ovulation Predictor kit or follicular monitoring for knowing precise dates. Also, you should get yourself investigated for irregular menstrual bleed. It could be early pregnancy which miscarried, stress, anxiety, weight changes, thyroid hormonal fluctuations or polycystic ovaries. The consultation is all the more important since you are trying to conceive. Take care",PCOS,pcos
"Starting 2 days ago, I experienced extreme fatigue and muscle pain & weakness, especially in my calves and legs. Saturday, yesterday, (and today my fingers, palms were numb with mottled red color, feet were also numb, more muscle pain and weakness in lower and upper arms, calves and thighs. Hard to make a fist in both hands, write, hold things or do productive movements in both hands. Joints are not swollen. Quick onset for tingling and muscle weakness. History of type 2 diabetes, on glipizide 10mg 2x/day and levermeir 18 unit IM at night. Got over sinisitis with antibiotics - a couple weeks ago, contracted it end of July. Lasted over 6 weeks. Had rheumatoid arthritis as young adult, no active issues for years. Do I need to take immediate action or wait and see if this passes.","Hi, Thanks for writing in. There is a possibility of diabetic neuropathy in you that must be investigated in detail. Diabetes itself starts affecting the nerves, eyes and kidneys in all patients having the condition for years. It is possible that you are experiencing the symptoms of diabetic neuropathy. Possibility of vitamin B 12 deficiencies must also be considered. In those taking oral glucose lowering medications like metformin, there is malabsorption of vitamin B 12 from the intestines. This can cause a chronic deficiency state and leads to symptoms like numbness and tingling in arms and feet. Please get examined by your doctor regularly and take vitamin B 12 supplements. This will restore vitamin B 12 levels to normal and prevent deficiency state. Please do not worry.",PCOS,metformin
"I am a male, 68 yoa, no heart conditions, quit smoking. I have hypertension for which i take meds for. I have Type II diabetes for which I take glipizide 10 mg tabs 2 x daily and Metformin 500 mg twice a day. For the first time since I quit smoking (July 1, 2015) I have noticed my blood pressure drops significantly between meals. Just within the last half-hour I was feeling a bit dizzy and my lips and tongue was feeling numb. My blood sugar was 57. I have not experienced this YYYY@YYYY","Evidently you have to many medical conditions you have not adored me if you have COPD this can cause respiratory insufficiency and hence your symptoms you may have neuropathy due to diabetes which may cause low blood pressure, but it could also be to deep blood pressure medications that you are taking you make consult your regular physician to adjust the dose of your medications if your blood sugar control is not a very good then this level of blood sugar can also cause numbness and dizziness that you're complaining are you should check regularly with your physician once a month and go over to your medications",PCOS,metformin
hello sir i m 27 yr old male married since last year . we hv been trying for a child but are still not successfull. my wife is 26 yr old and her TSH levels are slightly elevated. she also has galactorrhoea since last 4 years. her prolactin levels are about 25 units. she had been started on thyroxine 25 mcg OD daily and tab cabergoline 0.25 mg once weekly recently along with tab oflox-oz 1 bd & tab fluconazole 150 mg stat . my semen analysis was normal except for 8-10 pus cells. what does it indicate. what investigations should i undergo? is this the right treatment we are taking? is cabergoline better then bromocriptine if we desire pregnancy? sir plz reply . we would be highly obliged,"Hello dear, I understand your concern. In my opinion you are on correct line of treatment. Your wife has problems of hypothyroidism and galactorrhea both are the cause of female infertility. They might cause hormonal imbalance leading to irregular ovulation and irregular cycles. Cabgoline is better than bromicriptine and increases the conception chances. Cabgoline is given as tapering dose and the prolactin level is repeated after the course. The prolactin level is only mildly elevated.(up to 20\u00a0ng/ml is taken as normal). But both the problems are correctable and once the level becomes normal the conception becomes successful. Presence of pus cells in semen indicate infection, and it needs a course of antibiotics to be taken. Nothing to worry. Avoid stress. As both your and your partners problems are correctable and reversible. There are good chances of pregnancy once they are corrected. Hope this helps. Best regards....",PCOS,hormonal imbalance
I have had the Mirena for about 8 months. I have had light periods every month. About two weeks ago I started having dark brown discharge and it still hasn t stopped. I have a history of ectopic pregnancy. Could it be possible that this is another ectopic?,"Hello, I have gone through your query and understood the concern. It is possible to have abnormal menstrual pattern with the IRENA IUD as with the other hormone contraceptives. Yet, since you have had almost regular menstrual pattern all these months which implies hormone balance, this discharge should be considered abnormal. Chances of ectopic pregnancy are raised with intrauterine devices and in view of your history, I would ask you to go for a proper clinical appraisal immediately. A sonogram of the pelvis should be done to detect any ectopic pregnancy. If negative, you can be treated for hormone imbalance after excluding local causes like infection, polyps and erosion. Hope this helps.",PCOS,pcos
