Question,Answer,Topic,Keywords
"Hi. Me and my husband are planning to have baby. I was suppose to get my period on 31st August and i didnt. We did home pregnancy test i.e on 9th and 16th of September and it came out negative. We went to see gynea on 16th September and did blood test and it came out negative as well. Doctor prescribed me Primolut Nor 2 tablets a day for 2 days for the period. And uptil now, 24th September, I still havent got my period. Whats happening?","Hi there, I have understood your concern and I will suggest you the best possible treatment options. Please do not panic. As your blood test results suggest that there is no pregnancy, in such situations I usually suggest to my patients to take Primal N tablets 2 times a day for 5 days. Usually menses start 3 to 10 days after finishing the tablets. I will suggest you to get USG done to know about ovarian volume and echo texture. This will help to rule out PCOS-polycystic ovaries as a cause of delayed periods. As you are trying to get pregnant, please get your post menstrual HSG done-Hysterosalpingography. This will help to know about the patency of the fallopian tubes. Partners semen analysis with 3 to 4 days abstinence, will help to know about quality and quantity of the sperms. Please start follicle study from day 10 of the cycle, to know the day of ovulation. You can opt for GUI or have unprotected sex activity on the day of ovulation. If needed please seek prescription support from your treating doctor for ovulation induction medicines like Camphene citrate. Opt for a healthy diet and regular exercise regimen. Include more portions of fruits and vegetables and salads in daily diet. Avoid refined sugars and deep-fried foods and bakery products. Start on Folic acid and vitamin B 12 supplements regularly. This helps you to prevent various complications during pregnancy and delivery. Meditate regularly. Think positive. May God bless you with a bundle of Joy. I hope this answer helps you. Thanks",PCOS,pcos
Hello. I have been diagnosed with PCOS and have extremely rregular periods. My last period must have been just over 3 monhs bac. Lately I have just been spotting lightly. On Thursday I discovered that I have a dar brown discharge-not heavy. I only saw it when I wiped myself with tissue. On Saturday morning there was something like a normal blood clot and then back to the brown discharge. Should I be worried?,"Hallow Dear, It is a small trickle of blood that did not escape the uterus due to its quantity. Then it came out subsequently. Old blood is always brown. In PCs, the menses are usually irregular, delayed menses followed by profuse bleeding. However, occasionally trickle or spotting may take place which may come out after few days as brown discharge. I do not think, there is any cause for worry. Just get your PCs treated scientifically.",PCOS,pcos
"About two weeks ago, me and my boyfriend were fooling around. At first we had underwear and boxers on and we were just kissing. That is basically all we did. At the end, My boyfriend may have had some preejaculate on his fingers, he tried to finger me, but I got nervous so he didn t end up going up. I m not positive if their was pre- ejaculate on his fingers. I don t think their was, but just in case. He didn t ejaculate two weeks prior to that. I didn t get my period today and I was suppose to. The past three months I ve been getting it the 25-26.I m thinking it is just because I am nervous.I also didn t sleep very well the last two nights, could that be why my period is delayed? Do you think I am pregnant?","Hello dear, I understand your concern. In my opinion there is no chance of pregnancy in your case. There is scope for pregnancy when the semen is ejaculated inside or around the vagina during the fertile period. As such no ejaculation happened the chance of pregnancy is rare. So relax. Nothing to worry. Yes tension regarding the thought of pregnancy also causes hormonal imbalance and delays the period. So relax and check for the period. Best regards...",PCOS,hormonal imbalance
"is it possible that i will get pregnant? i have polycystic ovaries, anteverted uterus, missed period every 3-4months. i had checked up with my ob-gyne, she advised me to go on diet, take pruvera and metformin. my concern is, is it possible for me to get pregnant? what should i do?","Hi, PCOS is very complex disease and cause menstrual irregularity. Following are aim of treatments",PCOS,"pcos, metformin"
"hi.., iam 27 yrs old , with height 5ft and wt 65kg. i am married since last 2.5 yrs , want to conceive, but have found high levels of insulin in blood. As per doctor , have signs of PCOS, and am also over weight. have twice been given ovulation, olvulation has occured but no pregnancy. Iam prescribed Bigomet SR 500 , thrice a day , and Blong F. Will this help me in getting pregnant?","Hello dairy understand your concerned have PCs sign and cause insulin resistance. I would suggest taking proper treatment under advise of gynecologist after undergoing, reproductive hormone analysis, USG scan and ovarian follicle study. Bigomer Sr 500",PCOS,"pcos, insulin resistance"
"hi i think i might be pregnant, i have all the symptoms, very sore and painful breast, and very itchy at times. back aches feeling sick. and horrible tast in my mouth. the only problem is my periods are every 3 months. last one was the 2nd of august. but i had a bleed about 3 weeks ago. i had sex on the 19th august.i have taken pregany test and i did see a very faint line, but just about. do you think i might be. kayleigh","Hi, I understand your concern. The symptoms you have are seen in early pregnancy as well as hormonal imbalance. Looking at your 3 monthly menstrual cycle, if it is regularly SOI- 19th August is less likely to be your ovulation time. But if the cycles are irregular, with pregnancy test showed faint 2nd line. Ie, weak +ve, go for repeat urine pregnancy test/ USG pelvis for confirmed results. Thanks.",PCOS,hormonal imbalance
"Hi, I have a lot of gas, sharp pain in my lower abdomen and lower back. I have endometriosis and pcos. I have lost a lot of hair and gained about 30 pounds in the last year and cant seem to lose it. I also seem to have frequent urination and an average of one bowel movement a day. Im a 24 year old female. I also suffer from ptsd because of being raped by 15+ men in the last 3 years. Ive had 20+ sexual partners. I dont know if any of these relate at all but I figured I should give you any information that may be helpful. Any idea what would cause this pain and tons of gas?","Hi, You are 24 year, female, You have a lot of gas, sharp pain in lower abdomen and back, You have endometriosis and P.C.O.S, hair loss, weight gain, frequent urination. You have 2 issues, one is pelvic infection, second is gastric irritation. I advise you to consult a gynecologist for treatment. UN less the infection is completely treated you can't be relieved of the backache. I usually advise my patients' omeprazole, risperidone combination once daily in empty stomach, for gas problem. Thank you.",PCOS,"pcos, weight gain"
"Hi, may I answer your health queries right now ? Please type your query here... yesterday i had a terrible cramp that lasted for and hour straight with no relief have only spotted three times and i thought at first i was pregnant but now im not sure.","Hi. Abdominal cramps are not a conclusive symptom indicating towards any one issue/condition. But if there was a history of unprotected sexual contact then I would recommend a home pregnancy test to be conducted using an early morning urine sample to be conducted on or after the second day of a missed period. If pregnancy is ruled out then it would be wise to visit a doctor to check on other causes like hormonal imbalances, gastrointestinal conditions, etc. Best wishes.",PCOS,hormonal imbalance
"hi, i am 20 years old and got married 8 to 9 months ago,, iam a pcos patient,, unable to conceive,, my gynaec prescribed me a treatment of having fertyl super from second day of periods till 5 days and folvite daily,, this is my secound round of treatment and still dint get to hear any good news,, pls do suggest me a nice method to conceive","Hi I have gone through your question. As in pod (polycystic ovarian disease) small follicles are there, but not a single follicle mature and rupture. So ferry given to stimulate ovaries to develop follicles so can become fruitful for fertilization. I would advise continuing this for next 3 cycles at least. Folvite contains vitamin B complex which is prescribed to prevent early congenital defect in focus. Hope I answered your question. Would be happy to help you further. Take care.",PCOS,pcos
"Hi, I had a question about some symptoms ive been having. I figure I should ask a gynecologist about a couple of these symptoms but Im not sure if you could help me out with the rest of them. Symptoms include","Hi, we surely can help you though if you had mentioned your age, describing and diagnosing your symptoms could have been much easier.nevertheless, all your symptoms basically points towards hormonal imbalance which could be menopause, if you are near about the particular age. The other symptoms are pointing towards diabetes which could be confirmed by investigations. You also need to check the severity of thyroid hormones level as hypothyroidism could also be one of the culprit for the existing symptoms. So my dear, please visit your nearest physician and start with the required treatment. Hoping for the best for you.",PCOS,hormonal imbalance
i would like to know the side effects of istamet sitagliptin i have been using the above mentioned tablet with no noticable improvement in the blood sugar level. is there any combination drugs that i could use for better sugar control. thanks bhuvana YYYY@YYYY,"Hi, Stamen is a combination of two medicines (sitagliptin and metformin) commonly prescribed to control high blood sugar levels in people with type 2 diabetes mellitus. Generally, it is well tolerated by most of the patients, however it may cause abdominal cramps, diarrhea, metallic taste, low blood sugar, headache, and sometimes a serious lactic acidosis (metformin). For better control of blood sugar another medication pioglitazone may be added to stamen after consulting your treating doctor. Hope I have answered your query. Let me know if I can assist you further. Take care",PCOS,metformin
"I m currently taking microgynon 30 and on Monday morning I realised I hadnt taken saturday and sunday s pills.so I took both in the morning, I usually take my pill at around 9pm everyday. So shall I take a third pill tonight or skip this third pill today and start again tomorrow night?","Hi, It is not advisable to take three pills of microgynon on the same day, as it may lead side effects like nausea, vomiting, headache, bloating due to extra amount of hormones you ingested. It may also affect menstrual cycle badly due to hormonal imbalance causing irregular or abnormal vaginal bleeding. Continue taking the remaining microgynon pills as usual, meaning taking the next one at your usual time the next day. Hope I have answered your query. Let me know if I can assist you further.",PCOS,hormonal imbalance
usually my periods delays for 15 to 20 days. i got married 1.5 years before and dont have any child yet. before marriage when i consult a doc in Pakistan she advised me few tests and ultrasound as well. when reports came she informed me that my right ovary is 1.5 cm enlarge. she gave me dine1 for three months and primolut n also for 3 months. after that my reports were okay. now again after 3 years i m fACING the same problem. van u suggest me anything or what is the next step? plzzzzzzzzzzzzz inform me as soon as possible.,Hello. Thanks for writing to us. It seems that you are having a hormonal imbalance or polycystic ovaries. You need to get yourself properly investigated by your gynecologist including some blood tests and ultrasound scan so that specific treatment can be started. I hope this information has been both informative and helpful for you. You can consult me again directly through my profile URL http,PCOS,hormonal imbalance
"Good morning Dr I have been ttc for 2 years now was diagnosed with pcos and endometriosis I did my laparoscopy surgery a month ago, we been ttc since than,two days ago I noticed that my vigaina is getting no wet then normal . Could it be a early sign off pregnancy?","Hi, Certain vaginal changes are bound happen during early pregnancy, but it is not possible to predict that you could be pregnant or not based on such changes alone. You need to take a urine pregnancy test after a week if you miss your periods or if it is delayed. If it comes positive, you need to confirm it by means of ultrasound scan investigation and clinical evaluation by consulting Gynecologist. Hope the information provided would be helpful. Let me know if I can assist you further. All the best.",PCOS,pcos
"is letrozole 25 mg good for me .i want to get preg fast? 29 yrs,pcod,irregular periods three month course of duluote-L then letrozole25mg for 5 days 1 tbl daily. no pregnancy is found .question is wether i stay with letrozole having double dose or again continue three month course of duluote-L ? as i had started letrozole this month could this tbl work for me if i start this medicine again. I want preg fast",Don't take double dose like that. As advised you need to take the medicines by your Doctor. Metronome helps to reduce hormonal imbalance and increase chances of ovulation. Main method to help cure POD is by losing weight. Eat healthy. Exercise daily. Achieve good blood sugar control. Do ultrasound monitoring of ovulation to know when to have sex to increase chance of conception.,PCOS,"pcod, hormonal imbalance, irregular periods"
"am i eligible to deliver a baby with L5-S1 disc prolapse and protrusion? Hello sir, Am 31 yrs -female - had a c-section 3 years ago. I have L5-S1 disc prolapse(dont know how it came) with protrusion and also recently diagnised with more insulin - abt 42.8 units- taking metformin advised for 3 months - I would like to have a second baby - am I eligible? If yes - when can I proceed and what are all the cautions?","Hi welcome, due to disc problem no need to worry only you should be in rest during the time. For increased insulin any way you have to take medicines to reduce it otherwise consumption will not lead to child. Any way never leave this disc problem as simple thing and also never go for the surgery also since it is not an over growth or waste thing to be removed, and also effective treatments are available in Ayurveda along with panchakarma keep in touch for further [email redacted]",PCOS,metformin
"hi,,,im 25 y/o was diagnsed a while ago having bilateral polycystic ovaries,,,and retroverted uterus,,,with few fluid in the cul de sac,,,i was worried about it,,,my husband is working abroad,,,and he was about to come on end of nov this year,,,and we were planning to have a baby,,,hope so,,,do you think its possible to conceive having all of this???hope you can help me,,,thanks,,,","Hi. It is still possible to conceive, but do not take conception for granted and make sure you consult an obstetrician who will guide you through to conception and delivery. In my opinion, I am guessing you may require hormonal pills to help regularize your cycle before your husband comes, and then initiate fertility medication from there on. Please do speak to a doctor for proper guidance. Best wishes.",PCOS,pcos
"Hi I have been diabetic T2 for the last 2 years now my med is metformin 500mg per day and I am also taking Prinivil for blood presure 5mg per day-I am now living in Crete Greece originally from UK I have been in crete for 18 months and with the meditereanian diet I have lost about 33 k (i now weigh 13.1/2 stone I am always feeling light headed Numbness arms,legs,feet.hands-yet my blood sugar readings are good- between 108-112 my blood presure is good too but i am always walking around as if i am drunk however it is worse when I am trying to sleep which seems strange as I should be more relaxed. sometimes I feel so light headed laying down that I have to sit up in case I pass out (which i have not done as yet)","Hi, Your could be related to generalized fatigue, weight loss or due to nutritional deficiencies. Metformin use can cause Vitamin B12 deficiency which can present as fatigue, burning sensation or pins and needle sensation. Regular use of Vitamin b12 tablets should be taken after food. Maintain your weight within the normal body mass index. Your symptoms will reduce in the subsequent days. Take care. Hope I have answered your question. Let me know if I can assist you further.",PCOS,metformin
"Hi,I am trying for baby but suffering from PCOS problem. I am undergoing treatment and doctor is advising Fertomid from last 3 cycles and from this cycle i have started with Oosure. I have did ovulation study for 2 cycles. Ovulation is happening on 20th day bt i am not conceiving. Please help.","Yes.I can understand your concern. In my opinion now u should stop Fatimid as u have taken it in the 3 cycles, and now it might have become resistant.u better stop this only for one cycle and then in next cycle u start it from 2nd day of your menses and this month u take tab polite 5 mg once daily, syrup eve care 2 spoons daily and tab ova bless once a day(it is good in PCs pts).then in next cycle Fatimid for 5 days and go for follicular study and when your follicle size becomes 18-20 mm and endometrium min 10 mm then u try and let's hope for the best. If even then no result then decide for medical procedure",PCOS,pcos
"I took a morning after pill the day I was supposed to start my period and Im 5 days late already but I have all the symptoms of being on my period. It was unprotected sex but my boyfriend didnt ejaculate in me, so I dont see how I could be pregnant but I just wanted to make sure I was safe and ask.","Hello dear, I.understand your concern. In my opinion the day of expected period comes under safe period in case of regular cycles. Theremight be no need of protection as the risk of pregnancy is nil even with unprotected sex. But as you have taken morning after pill it causes hormonal imbalance and might cause delay in the period. So the delay is due to pill effect. Wait for spontaneous onset of period for 10 days more. The chance of pregnancy is very, very rare as sex was done in safe period and there was no ejaculation in, and also you have taken morning after pill. So relax. Best regards...",PCOS,hormonal imbalance
hi my name is Jocelyne and recently I went to the doctors and they told me I had one ovary smaller then the other and they also said that my menstrual cycle would be irregular. my question is whether or not birth control would help make my menstrual cycle come every month or would it just damage my reproductive system even more?,"Hello Jocelyn, Thank you for the question. It is quite unclear as to what your doctors told you about your ovaries. Is your menstrual cycle irregular? Have they told you that you have POlycystic ovaries? If yes then birth control pills are in fact the right choice of medicines to get your period regularly. Birth control pills are low doses of hormones which will allow your periods to come every month at a regular interval (during the pill free period). There is no evidence that these pills damage the reproductive system. There maybe some side effects with these medicines like headaches, nausea vomiting, breast tenderness, but these are mild and fade away in few days to weeks.However, these pills are not going to cure your underlying problem. So do discuss with your treating doctor about the cause for your irregular periods and ovary being small. I am sure your doctor will explain after seeing the reports if any. Hope this helps. Take care.",PCOS,irregular periods
i am 20 yrs old.my last mensural cycle is july-7 to july-14.we keep sex from july-20.basically i am irregular in mensural cycle two monts/50 days once i will get my period.but now i am reached 88days.but i didnt get my mensus.i am confused whether i am pregnant or not?.we cheked in pregnancy test tube it gives negative.but my breast is too big now and my stomach is gained weight???pls help me...,"Hello dear, I understand your concern. In my opinion there are various causes for irregular periods like thyroid abnormalities, polycystic ovarian disease(POD), overweight,obesity, stress, anemia etc. If there was any pregnancy it would have shown up by now in the urine pregnancy test. So sorry the chance of pregnancy might not be there. I suggest you to rule out the above said causes of irregular periods. The investigations like thyroid profile, ultrasound,serum prolactin might be essential for diagnosing the condition. Weight reduction in case of overweight or obesity are helpful. Avoid stress if any. Once the cause is treated cycles become regular and the pregnancy chances increase. Relax. The increase in size of breast and abdomen might not be related to pregnancy. Hope this helps. Best regards...",PCOS,irregular periods
"I had a Mirena IUD inserted a month ago. I have bled everday since insertion, from light spotting to heavy bleeding. The more physically active I am the more heavily I bleed and the more pain I have pain every I can only associate with the IUD because it was not present until the IUD was inserted. I have pain while active and while at rest. Should I have it removed or is there potentially something wrong with it?","Hi. Mirena contains Levonorgestrel, a progesterone that is released slowly, daily for a period of five years. One of the main problems of IUD like IRENA is interred menstrual bleeding in the initial 3 to 6 months. Progesterone results in spotting, vaginal discharge, abdominal pain. Mood changes and bloating sensation. But these symptoms wane off after few months as the body gets adopted to the effects of progesterone and the hormonal imbalance due to IRENA.Funds can result in vaginal infection or pelvic inflammatory disease (PID) which will also present with similar symptoms of pain, discharge and spotting. If the spotting and abdominal pain persists or if it worsens, then you should consult your treating",PCOS,hormonal imbalance
Respected sir madam.. I had an unprotected sex with my gf after a week from her period ....means on 6th of this months she have periods and we contact on 13th...n she have unwanted 72 pills within 5 hours ...but then problem is that,Hello misunderstand your concern It may be due to side effect of pill or mechanical trauma during sexual intercourse. I think it is most commonly due to side effect of unwanted 72. Abdominal pain may be occurred in some case and hormonal imbalance produce by pill produce mild vaginal bleeding due to high progesterone in pill. It also causes slight delay in the period as it cause prolongation of second phase of cycle. But if period will be delay by more than 10-12 days then go for pregnancy confirmation as it has 5 percent failure rate. Take metal spas for abdominal pain and maintain proper pelvic hygiene. Hope this may help you Best regards,PCOS,hormonal imbalance
"Hi doc, I m 31 trying to get preg for 1 yr invain! I have hypothyroidism for which I take thyronorm 100 mg and also PCOS ... I recently visited a gyn and she suggested tab siphene 50 mg and biopreg f for a follicular monitoring ..! Are there better chances of getting pretreat with these medicines? And is the line of treatment correct?","Hello, Patients of PCs really find very difficult to get pregnant. Medicines given for Follicular monitoring are perfectly alright, and you must take them regularly. Make sure that your thyroid levels are in normal range and so you keep on taking your medicine regularly and also get your thyroid function tests done regularly. Besides this there are two very important things to do.1... You must take METFORMIN 500 mg twice a day regularly. Consult your doctor for this.2... Do regular exercises and reduce your weight. Thanks",PCOS,"pcos, metformin"
My bf fingered my vagina.... On 16 oct.. I was not havving any problem.. Then on 22 oct i had outside food and in evening my left abdomenal region was aching very badly.. ?? I went to the d dr.. And she said tht dnt intake outside food.. Last month i got my periods on 3sept.. Wht would be the reason of paining the left abdominal side.. ?? Please help I will get periodss this month ??,"Hi, Thanks for writing in. Left sided abdominal pain after having outside food can be due to bowel infection. This pain usually responds to taking antibiotics. You have not mentioned any episode of loose motions. However, mild bowel infection can occur without loose motions. Coming to your concern about periods, you should have had your periods much earlier if you have a regular 28 days cycle. Not having periods can have many reasons like hormonal imbalance, thyroid disorder, anxiety, PCs, anemia. Please get yourself clinically evaluated for any medical condition that you may have. Be sure that you did not have unprotected sex since your last menstrual period or there was no deposition of semen close to your vagina by fingering or any other means. Hope this helps",PCOS,hormonal imbalance
